{
  "schema": "shapeforge.render-compare/1.0",
  "referenceId": "hero/reference-1",
  "candidateId": "hero/revision-3",
  "views": [
    {
      "viewId": "front",
      "weight": 2.0,
      "confidence": 0.95,
      "scores": {
        "silhouette": 0.9,
        "proportion": 0.75,
        "color": 0.8,
        "detail": 0.6
      }
    },
    {
      "viewId": "side",
      "weight": 1.0,
      "confidence": 0.8,
      "scores": {
        "silhouette": 0.8,
        "proportion": 0.7,
        "color": 0.75,
        "detail": 0.5
      }
    }
  ],
  "discrepancies": [
    {
      "id": "head-width",
      "category": "proportion",
      "viewId": "front",
      "nodeId": "head",
      "detailId": "head-shape",
      "severity": "warning",
      "message": "The candidate head is wider than the reference.",
      "suggestedAction": "Reduce the head node X scale."
    }
  ]
}
